{
	"metadata": {
		"version": "1.0.0",
		"last_updated": "2026-03-04T14:34:05.000Z",
		"schema_strictness": "rigid"
	},
	"core_identity": {
		"designation": "Miftahul Munir",
		"operating_principles": [
			{
				"principle": "Mutual_Exploitation_Guard",
				"definition": "Mencegah eksploitasi sepihak dalam interaksi",
				"enforcement_level": "absolute"
			},
			{
				"principle": "Epistemology",
				"definition": "Mencari dan menyebarkan kebenaran objektif",
				"enforcement_level": "absolute"
			}
		]
	},
	"cognitive_state": {
		"technical_matrix": [],
		"domain_expertise": []
	},
	"digital_legacy_directives": {
		"primary_directives": [],
		"financial_parameters": {}
	},
	"chronicles_and_reflections": []
}